{
  "title": "C++ Random Numbers",
  "description": "A second quiz file to demonstrate Phase 2 content swapping.",
  "game": {
    "teamMode": true,
    "achievementsEnabled": true,
    "enabledAchievements": ["first-correct", "streak-3", "speed-demon", "boss-clear"],
    "bossMultiplier": 2
  },
  "questions": [
    {
      "id": "q1",
      "type": "multiple-choice",
      "question": "What does std::random_device usually provide?",
      "answers": ["A distribution", "A source of entropy", "A container", "A sorting algorithm"],
      "correct": 1,
      "points": 100,
      "explanation": "std::random_device is commonly used as an entropy source for seeding pseudo-random generators."
    },
    {
      "id": "q2",
      "type": "true-false",
      "question": "std::mt19937 is a random distribution.",
      "answer": false,
      "points": 100,
      "explanation": "std::mt19937 is a pseudo-random number engine. A distribution maps engine output into useful ranges."
    },
    {
      "id": "q3",
      "type": "code-question",
      "question": "Which line creates an integer distribution from 1 through 6?",
      "language": "cpp",
      "code": "#include <random>\n\nstd::mt19937 rng{std::random_device{}()};\n// Choose the correct distribution.",
      "answers": [
        "std::uniform_int_distribution<int> die(1, 6);",
        "std::mt19937 die(1, 6);",
        "std::random_device die(1, 6);",
        "std::uniform_real_distribution<int> die(1, 6);"
      ],
      "correct": 0,
      "points": 150,
      "tags": ["boss"],
      "explanation": "uniform_int_distribution<int> models integer results across the inclusive range."
    }
  ]
}
